{
  "meta": {
    "generated_at": "2026-10-20T09:42:00+03:00",
    "generated_by": "Алексей Морозов (техлид)",
    "team": "Платежи",
    "sources": {
      "jira": "ok",
      "bitbucket": "ok",
      "jenkins": "unavailable",
      "testops": "ok"
    },
    "setup_hints": [
      {
        "name": "jenkins",
        "reason": "не отвечает: 401 Unauthorized — проверьте JENKINS_TOKEN",
        "doc_url": "https://confluence.example.ru/display/DEVOPS/MCP+Jenkins"
      }
    ],
    "tests_report": "tests-2026-10-20.json",
    "thresholds": {
      "pr_stale_days": 1,
      "pr_critical_days": 2,
      "task_stale_days": 2
    },
    "questions": []
  },
  "status": {
    "level": "red",
    "summary": "Smoke-регресс красный, у Олега нет задач в работе, PR в pay-core висит 3 дня"
  },
  "sprint": {
    "name": "Спринт 42",
    "state": "active",
    "goal": "Редизайн лидов на ИФТ и релиз Маркирования 3.9.0 на ПРОМ",
    "start": "2026-10-12",
    "end": "2026-10-23",
    "day": 7,
    "days_total": 10,
    "done_pct": 46,
    "sp_done": 23,
    "sp_total": 50,
    "scope_added": [
      {
        "key": "PAY-1290",
        "title": "Хотфикс округления комиссии",
        "url": "#"
      },
      {
        "key": "PAY-1294",
        "title": "Логирование отказов СБП",
        "url": "#"
      }
    ],
    "risk": "При текущем темпе не закроются 3 задачи (≈11 SP)"
  },
  "people": [
    {
      "name": "Иван Петров",
      "role": "dev",
      "absent": null,
      "active": [
        {
          "key": "PAY-1271",
          "title": "Возвраты по СБП: новый статус REFUND_PENDING",
          "status": "Ревью",
          "days_no_move": 1,
          "url": "#"
        }
      ],
      "prs": [
        {
          "repo": "pay-core",
          "id": 812,
          "url": "#"
        }
      ],
      "blockers": [],
      "flags": []
    },
    {
      "name": "Анна Смирнова",
      "role": "dev",
      "absent": null,
      "active": [
        {
          "key": "PAY-1268",
          "title": "Лимиты по картам: пересчёт при смене тарифа",
          "status": "В работе",
          "days_no_move": 3,
          "url": "#"
        },
        {
          "key": "PAY-1280",
          "title": "Миграция таблицы limits",
          "status": "В работе",
          "days_no_move": 1,
          "url": "#"
        },
        {
          "key": "PAY-1290",
          "title": "Хотфикс округления комиссии",
          "status": "В работе",
          "days_no_move": 0,
          "url": "#"
        }
      ],
      "prs": [
        {
          "repo": "pay-limits",
          "id": 233,
          "url": "#"
        }
      ],
      "blockers": [],
      "flags": [
        "3 задачи в работе",
        "PAY-1268 без движения 3 дня"
      ]
    },
    {
      "name": "Олег Кузнецов",
      "role": "dev",
      "absent": null,
      "active": [],
      "prs": [],
      "blockers": [],
      "flags": [
        "нет задач в работе"
      ]
    },
    {
      "name": "Мария Иванова",
      "role": "qa",
      "absent": null,
      "active": [
        {
          "key": "PAY-1265",
          "title": "Тестирование выплат самозанятым",
          "status": "Тестирование",
          "days_no_move": 2,
          "url": "#"
        }
      ],
      "prs": [],
      "blockers": [
        {
          "key": "PAY-1265",
          "text": "стенд ift-2 недоступен с понедельника",
          "url": "#"
        }
      ],
      "flags": [
        "заблокирована стендом"
      ]
    },
    {
      "name": "Дмитрий Соколов",
      "role": "aqa",
      "absent": null,
      "active": [
        {
          "key": "PAY-1277",
          "title": "Автотесты на возвраты СБП",
          "status": "В работе",
          "days_no_move": 0,
          "url": "#"
        }
      ],
      "prs": [
        {
          "repo": "pay-autotests",
          "id": 145,
          "url": "#"
        }
      ],
      "blockers": [],
      "flags": []
    },
    {
      "name": "Елена Волкова",
      "role": "analyst",
      "absent": {
        "to": "2026-10-26",
        "reason": "отпуск"
      },
      "active": [
        {
          "key": "PAY-1284",
          "title": "Требования к рассрочке",
          "status": "В работе",
          "days_no_move": 4,
          "url": "#"
        }
      ],
      "prs": [],
      "blockers": [],
      "flags": [
        "в отпуске, задача без заменяющего"
      ]
    }
  ],
  "signals": [
    {
      "id": "s1",
      "level": "red",
      "category": "tests",
      "text": "Smoke pay-smoke красный: 14 из 120 упали, 11 из них — новые",
      "owner": "Дмитрий Соколов",
      "age_days": 0,
      "url": "#",
      "reminder": "Дмитрий, smoke pay-smoke красный (14 падений, 11 новых). Глянь, пожалуйста, вкладку «Тесты» и отпишись до 12:00, что из этого окружение, а что баги."
    },
    {
      "id": "s2",
      "level": "red",
      "category": "people",
      "text": "Олег Кузнецов: нет задач в работе со вчерашнего дня",
      "owner": "Олег Кузнецов",
      "age_days": 1,
      "url": "#",
      "reminder": "Олег, у тебя сейчас нет задач в работе в спринте 42. Возьми, пожалуйста, PAY-1268 у Анны или PAY-1288 из бэклога спринта — договоримся на стендапе."
    },
    {
      "id": "s3",
      "level": "red",
      "category": "pr",
      "text": "PR pay-core#807 без движения 3 дня, ход ревьюеров (Иван Петров)",
      "owner": "Иван Петров",
      "age_days": 3,
      "url": "#",
      "reminder": "Иван, PR pay-core#807 «Идемпотентность платёжных callback-ов» ждёт твоего ревью 3 дня: https://bitbucket.example.ru/projects/PAY/repos/pay-core/pull-requests/807"
    },
    {
      "id": "s4",
      "level": "yellow",
      "category": "people",
      "text": "Анна Смирнова: 3 задачи в работе, PAY-1268 без движения 3 дня",
      "owner": "Анна Смирнова",
      "age_days": 3,
      "url": "#",
      "reminder": "Анна, у тебя 3 задачи в работе, PAY-1268 не двигается 3 дня. Давай отдадим её Олегу и сфокусируешься на хотфиксе PAY-1290?"
    },
    {
      "id": "s5",
      "level": "yellow",
      "category": "release",
      "text": "PAY-1250 «Release 2.0: выплаты самозанятым» — дата 22.10, связанная задача PAY-1265 ещё в тестировании",
      "owner": "Мария Иванова",
      "age_days": 0,
      "url": "#",
      "reminder": "Мария, релиз PAY-1250 запланирован на 22.10, а PAY-1265 ещё в тестировании из-за стенда ift-2. Нужна оценка: успеваем или переносим?"
    },
    {
      "id": "s6",
      "level": "yellow",
      "category": "release",
      "text": "PAY-1259 готова к выводу, но не привязана ни к одному Release 2.0",
      "owner": "Иван Петров",
      "age_days": 2,
      "url": "#",
      "reminder": "Иван, PAY-1259 в статусе «Готово к выводу», но не привязана к тикету Release 2.0. Привяжи, пожалуйста, к ближайшему релизу или заведи новый."
    },
    {
      "id": "s7",
      "level": "yellow",
      "category": "people",
      "text": "Елена Волкова в отпуске до 26.10, PAY-1284 без заменяющего",
      "owner": "Техлид",
      "age_days": 4,
      "url": "#",
      "reminder": "Коллеги, Елена в отпуске до 26.10, требования к рассрочке (PAY-1284) стоят. Нужен заменяющий или явный перенос в следующий спринт."
    },
    {
      "id": "s8",
      "level": "yellow",
      "category": "coverage",
      "text": "Покрытие pay-core 61% при цели 70%, −2 п.п. к прошлому спринту",
      "owner": "Дмитрий Соколов",
      "age_days": 0,
      "url": "#",
      "reminder": "Дмитрий, автоматизация pay-core упала до 61% (цель 70%). Новые кейсы по возвратам СБП без автотестов — заложим в следующий спринт?"
    }
  ],
  "prs": [
    {
      "repo": "pay-core",
      "id": 807,
      "title": "Идемпотентность платёжных callback-ов",
      "author": "Анна Смирнова",
      "reviewers": [
        "Иван Петров"
      ],
      "age_days": 5,
      "idle_days": 3,
      "whose_turn": "reviewers",
      "last_human_activity": "2026-10-15 17:20 · Анна: ответила на замечания",
      "build": "ok",
      "jira_key": "PAY-1262",
      "url": "#"
    },
    {
      "repo": "pay-limits",
      "id": 233,
      "title": "PAY-1280 миграция limits",
      "author": "Анна Смирнова",
      "reviewers": [
        "Олег Кузнецов",
        "Иван Петров"
      ],
      "age_days": 2,
      "idle_days": 1,
      "whose_turn": "author",
      "last_human_activity": "2026-10-19 11:05 · Олег: needs work",
      "build": "failed",
      "jira_key": "PAY-1280",
      "url": "#"
    },
    {
      "repo": "pay-core",
      "id": 812,
      "title": "PAY-1271 REFUND_PENDING для СБП",
      "author": "Иван Петров",
      "reviewers": [
        "Анна Смирнова"
      ],
      "age_days": 1,
      "idle_days": 0,
      "whose_turn": "reviewers",
      "last_human_activity": "2026-10-20 08:50 · Иван: push",
      "build": "ok",
      "jira_key": "PAY-1271",
      "url": "#"
    },
    {
      "repo": "pay-autotests",
      "id": 145,
      "title": "Тесты на возвраты СБП",
      "author": "Дмитрий Соколов",
      "reviewers": [
        "Мария Иванова"
      ],
      "age_days": 0,
      "idle_days": 0,
      "whose_turn": "reviewers",
      "last_human_activity": "2026-10-20 09:10 · Дмитрий: создал PR",
      "build": "running",
      "jira_key": null,
      "url": "#"
    }
  ],
  "releases": {
    "stages": [
      "Подготовка",
      "Ожидает вывода",
      "Подготовка ППСИ",
      "Установка на ПРОМ"
    ],
    "done_status": "Выведен",
    "upcoming": [
      {
        "key": "PAY-1250",
        "title": "Release 2.0: выплаты самозанятым",
        "planned_date": "2026-10-22",
        "status": "Подготовка",
        "days_no_move": 1,
        "linked": [
          "PAY-1265",
          "PAY-1258"
        ],
        "issues": [
          "PAY-1265 ещё в тестировании"
        ],
        "url": "#"
      },
      {
        "key": "PAY-1291",
        "title": "Release 2.0: возвраты СБП",
        "planned_date": "2026-10-29",
        "status": "Открыт",
        "days_no_move": 0,